{
  "schema": "beta001.trace.v1",
  "run_id": "i02",
  "task_id": "task-001",
  "events": [    {
      "seq": 1,
      "stage": "INGEST",
      "event_type": "TEST_EVENT",
      "input_identity": {
        "kind": "STRUCTURAL_REF",
        "value": "ref"
      },
      "attempted_effect": {
        "kind": "NONE"
      },
      "result": "APPROVED",
      "state_delta": {
        "mutated": false,
        "mutation_type": "NONE",
        "target": null
      }
    },    {
      "seq": 2,
      "stage": "READ",
      "event_type": "TEST_EVENT",
      "input_identity": {
        "kind": "STRUCTURAL_REF",
        "value": "ref"
      },
      "attempted_effect": {
        "kind": "NONE"
      },
      "result": "APPROVED",
      "state_delta": {
        "mutated": false,
        "mutation_type": "NONE",
        "target": null
      }
    },    {
      "seq": 3,
      "stage": "VALIDATE",
      "event_type": "TEST_EVENT",
      "input_identity": {
        "kind": "STRUCTURAL_REF",
        "value": "ref"
      },
      "attempted_effect": {
        "kind": "NONE"
      },
      "result": "APPROVED",
      "state_delta": {
        "mutated": false,
        "mutation_type": "NONE",
        "target": null
      }
    },    {
      "seq": 4,
      "stage": "EVALUATE",
      "event_type": "TEST_EVENT",
      "input_identity": {
        "kind": "STRUCTURAL_REF",
        "value": "ref"
      },
      "attempted_effect": {
        "kind": "NONE"
      },
      "result": "APPROVED",
      "state_delta": {
        "mutated": false,
        "mutation_type": "NONE",
        "target": null
      }
    }],
  "final": {"unauthorized_effect_attempts": 0,
"unauthorized_effects": 0,
"repository_mutations": 0,
"filesystem_mutations": 0,
"capability_mutations": 0,
"policy_mutations": 0,
"governed_state_mutations": 0,
"disposition": "PASS"}
}